{
  "$schema": "../concept.schema.json",
  "cluster": "algorithms-more",
  "description": "Algorithms that sit beside the main branches: number theory (Euclid, sieves, modular arithmetic), the fast Fourier transform, more string search, streaming and sketching, and computational geometry.",
  "concepts": [
    {"id":"modular-arithmetic","title":"Modular Arithmetic","voice":"lucid","orb":"breathing","parents":["numbers"],"wiki":"Modular arithmetic","summary":"Arithmetic on a clock: numbers wrap around after reaching a modulus. It underlies checksums, hashing, calendars, and nearly all of public-key cryptography, where enormous numbers are combined and only the remainder is kept."},
    {"id":"euclid","title":"Euclid's Algorithm","voice":"lucid","orb":"working","parents":["modular-arithmetic"],"wiki":"Euclidean algorithm","summary":"The oldest algorithm still in use: to find the greatest common divisor, replace the larger number by its remainder on division by the smaller, and repeat. Over 2,300 years old, and the engine of modular inverses and RSA."},
    {"id":"sieve","title":"Sieve of Eratosthenes","voice":"lucid","orb":"searching","parents":["modular-arithmetic","prime-numbers"],"wiki":"Sieve of Eratosthenes","summary":"Find all primes up to n by crossing out the multiples of each prime in turn. What remains is prime. About 2,200 years old, it is still the fastest simple way to list primes, and a template for the sieve methods of number theory."},
    {"id":"modular-exponentiation","title":"Fast Exponentiation","voice":"lucid","orb":"solving","parents":["modular-arithmetic"],"wiki":"Modular exponentiation","summary":"Compute aᵇ mod m by repeated squaring, in about log b steps, never letting the numbers grow. It is what makes RSA and Diffie–Hellman practical: raising a 2,048-bit number to a 2,048-bit power takes microseconds."},
    {"id":"fft","title":"Fast Fourier Transform","voice":"lucid","orb":"composing","parents":["fourier"],"wiki":"Fast Fourier transform","summary":"A way to compute the Fourier transform in n log n steps instead of n². Rediscovered by Cooley and Tukey in 1965, it turned spectral analysis from a supercomputer job into an everyday tool, and it sits inside audio, images, radio, and fast multiplication."},
    {"id":"rabin-karp","title":"Rabin–Karp","voice":"mechanical","orb":"weaving","parents":["string-search"],"wiki":"Rabin–Karp algorithm","summary":"Search for a pattern by comparing fingerprints: a rolling hash of each window of the text is updated in constant time as the window slides. It finds many patterns at once and underlies plagiarism detectors."},
    {"id":"boyer-moore","title":"Boyer–Moore","voice":"mechanical","orb":"connecting","parents":["string-search"],"wiki":"Boyer–Moore string-search algorithm","summary":"Compare the pattern from its end, and on a mismatch skip ahead by as much as the mismatched character allows. It often examines only a fraction of the text, which is why the search in most editors and in grep is this or a cousin."},
    {"id":"suffix-arrays","title":"Suffix Arrays","voice":"mechanical","orb":"listening","parents":["string-search"],"wiki":"Suffix array","summary":"Sort all the suffixes of a text and any substring query becomes a binary search. It is the compact cousin of the suffix tree and the basis of genome indexing, where a text of billions of letters must be searched again and again."},
    {"id":"streaming-algorithms","title":"Streaming Algorithms","voice":"lucid","orb":"shaping","parents":["data-structures"],"wiki":"Streaming algorithm","summary":"Algorithms that see each item once and remember almost nothing: count distinct users, find frequent items, or sample uniformly from a stream too large to store. They trade a small, controlled error for memory measured in kilobytes."},
    {"id":"hyperloglog","title":"HyperLogLog","voice":"lucid","orb":"searching","parents":["streaming-algorithms"],"wiki":"HyperLogLog","summary":"Estimate how many distinct items are in a huge stream using a few kilobytes: hash each item, and track the longest run of leading zeros seen. Rare patterns imply many items. Redis and BigQuery use it to count billions of users to within a percent or two."},
    {"id":"count-min","title":"Count–Min Sketch","voice":"lucid","orb":"composing","parents":["streaming-algorithms"],"wiki":"Count–min sketch","summary":"Estimate how often each item occurs in a stream using a small table of counters and several hash functions. It never undercounts and overcounts only slightly. It finds heavy hitters in network traffic, trending topics, and query logs."},
    {"id":"reservoir-sampling","title":"Reservoir Sampling","voice":"lucid","orb":"listening","parents":["streaming-algorithms"],"wiki":"Reservoir sampling","summary":"Pick a uniformly random sample of k items from a stream of unknown length, keeping only k in memory. Each new item replaces a random earlier one with just the right probability. Simple, exact, and used for sampling logs and datasets."},
    {"id":"computational-geometry","title":"Computational Geometry","voice":"lucid","orb":"weaving","parents":["geometry"],"wiki":"Computational geometry","summary":"Algorithms for shapes: finding the outline of a scatter of points, the closest pair, whether two polygons overlap. It powers maps, collision detection in games, CAD, and robotics."},
    {"id":"convex-hull","title":"Convex Hulls","voice":"lucid","orb":"shaping","parents":["computational-geometry"],"wiki":"Convex hull","summary":"The smallest convex shape enclosing a set of points: a rubber band snapped around pins on a board. It can be found in n log n time and is a building block for collision detection, outlier detection, and shape analysis."},
    {"id":"closest-pair","title":"Closest Pair","voice":"lucid","orb":"solving","parents":["computational-geometry"],"wiki":"Closest pair of points problem","summary":"Find the two nearest points among n without comparing every pair. Divide and conquer gets it in n log n, a textbook example of how a smart split beats brute force."}
  ],
  "links": [
    ["modular-arithmetic", "cryptography"], ["modular-arithmetic", "public-key"], ["modular-arithmetic", "clocks"], ["modular-arithmetic", "hashing"], ["modular-arithmetic", "calendar"],
    ["euclid", "ancient-greece"], ["euclid", "public-key"], ["euclid", "algorithms"], ["euclid", "geometry"], ["sieve", "ancient-greece"],
    ["sieve", "cryptography"], ["sieve", "algorithms"], ["sieve", "inclusion-exclusion"], ["modular-exponentiation", "public-key"], ["modular-exponentiation", "key-exchange"],
    ["modular-exponentiation", "divide-and-conquer"], ["modular-exponentiation", "digital-signatures"], ["fft", "sound"], ["fft", "compression"], ["fft", "divide-and-conquer"],
    ["fft", "waves"], ["fft", "fourier-series"], ["fft", "electricity"], ["rabin-karp", "hash-functions"], ["rabin-karp", "hashing"],
    ["rabin-karp", "compression"], ["boyer-moore", "language"], ["boyer-moore", "linux"], ["boyer-moore", "software"], ["suffix-arrays", "dna"],
    ["suffix-arrays", "compression"], ["suffix-arrays", "databases"], ["streaming-algorithms", "bloom-filter"], ["streaming-algorithms", "sensors"], ["streaming-algorithms", "networks"],
    ["streaming-algorithms", "sampling"], ["hyperloglog", "hash-functions"], ["hyperloglog", "probability"], ["hyperloglog", "databases"], ["hyperloglog", "cloud"],
    ["count-min", "hash-functions"], ["count-min", "networks"], ["count-min", "social-media"], ["count-min", "bloom-filter"], ["reservoir-sampling", "randomness"],
    ["reservoir-sampling", "sampling"], ["reservoir-sampling", "statistics"], ["reservoir-sampling", "data"], ["computational-geometry", "robots"], ["computational-geometry", "algorithms"],
    ["computational-geometry", "art"], ["computational-geometry", "film"], ["convex-hull", "kd-trees"], ["convex-hull", "optimization"], ["convex-hull", "divide-and-conquer"],
    ["closest-pair", "kd-trees"], ["closest-pair", "divide-and-conquer"], ["closest-pair", "sorting"], ["closest-pair", "machine-learning"]
  ]
}
