{
  "$schema": "../concept.schema.json",
  "cluster": "emotion",
  "description": "Feeling and its cultures. Love gets the deepest branch because so many other ideas run through it: attachment, friendship, family, loss, and forgiveness.",
  "concepts": [
    {"id":"emotion","title":"Emotion","voice":"layered","orb":"working","parents":["culture"],"wiki":"Emotion","summary":"Bodies share broad emotional capacities, but cultures teach us what to call a feeling, when to show it, and what it says about a person. Even pride and shame sit in different places on different maps."},
    {"id":"love","title":"Love","voice":"layered","orb":"weaving","parents":["emotion"],"wiki":"Love","summary":"Attention that stays. Cultures give it different forms, such as duty, romance, hospitality, and devotion, but the shape is recognizable: someone else's wellbeing becomes part of yours."},
    {"id":"attachment","title":"Attachment","voice":"layered","orb":"connecting","parents":["love"],"wiki":"Attachment theory","summary":"The bond that forms between a child and whoever reliably comforts them, and that echoes through later relationships. A secure early base seems to make it easier to explore, and to trust."},
    {"id":"oxytocin","title":"Oxytocin","voice":"quiet","orb":"working","parents":["attachment"],"wiki":"Oxytocin","summary":"A hormone released during birth, nursing, touch, and closeness. It's often called the love chemical, which oversimplifies a system that shapes trust and bonding together with many other signals."},
    {"id":"friendship","title":"Friendship","voice":"layered","orb":"listening","parents":["love"],"wiki":"Friendship","summary":"Chosen closeness, without the claims of blood or bargain. Friends witness who you're becoming, and few things predict a long, healthy life as reliably as having a few."},
    {"id":"family","title":"Family","voice":"layered","orb":"breathing","parents":["love"],"wiki":"Family","summary":"The people you're bound to before you've chosen anything. It's where language, food, and the first idea of love are learned, and where they're most often unlearned, too."},
    {"id":"forgiveness","title":"Forgiveness","voice":"layered","orb":"composing","parents":["love"],"wiki":"Forgiveness","summary":"Letting go of the claim on someone for what they did. It isn't excusing it or forgetting; it's deciding the hurt no longer gets to run the story, which often helps the forgiver most."},
    {"id":"agape","title":"Unconditional Love","voice":"layered","orb":"shaping","parents":["love"],"wiki":"Agape","summary":"Love that asks nothing back: the old Greek word for it was agape. Many traditions treat it as the highest kind, and nearly all agree it is easier to admire than to practice."},
    {"id":"loneliness","title":"Loneliness","voice":"layered","orb":"searching","parents":["love","shame"],"wiki":"Loneliness","summary":"The ache of wanting more connection than you have. It's not the same as being alone, and it is a genuine signal, like hunger, that people are built to live among others."},
    {"id":"grief","title":"Grief","voice":"layered","orb":"breathing","parents":["emotion"],"wiki":"Grief","summary":"What love turns into when the person it was for is gone. It comes in waves, has no schedule, and mostly eases not by ending but by making room around it."},
    {"id":"joy","title":"Joy","voice":"layered","orb":"composing","parents":["emotion"],"wiki":"Joy","summary":"A brightness that arrives without asking what it's for. It's often found in ordinary moments, and is easier to notice when you're not chasing it."},
    {"id":"laughter","title":"Laughter","voice":"layered","orb":"working","parents":["joy"],"wiki":"Laughter","summary":"An old, social sound that predates language. We laugh far more with others than alone, and it works mostly as a signal: this is safe, we're together."},
    {"id":"gratitude","title":"Gratitude","voice":"layered","orb":"weaving","parents":["joy"],"wiki":"Gratitude","summary":"Noticing what you were given, by people or by luck. Practiced regularly it tends to shift attention from what's missing to what's here, and it strengthens the ties it points at."},
    {"id":"anger","title":"Anger","voice":"layered","orb":"solving","parents":["emotion"],"wiki":"Anger","summary":"The feeling that a line has been crossed. It's information about what someone cares about, and it does the most good when it's understood before it's acted on."},
    {"id":"empathy","title":"Empathy","voice":"layered","orb":"listening","parents":["emotion"],"wiki":"Empathy","summary":"Feeling something of what another person feels, or at least understanding it from the inside. It's what makes care possible, and it's tiring enough that we need to choose where to spend it."},
    {"id":"fear","title":"Fear","voice":"layered","orb":"searching","parents":["emotion"],"wiki":"Fear","summary":"An old alarm with many new triggers. Fear points at what might be lost, and each culture decides what's worth fearing and who is allowed to be afraid."},
    {"id":"courage","title":"Courage","voice":"layered","orb":"shaping","parents":["fear"],"wiki":"Courage","summary":"Acting well while afraid, not without fear. It's a decision that something matters more than the risk, and it's usually much smaller and quieter than the stories make it seem."},
    {"id":"anxiety","title":"Anxiety","voice":"layered","orb":"working","parents":["fear"],"wiki":"Anxiety","summary":"Fear about what hasn't happened. It has a purpose, to prepare you, but when it can't find a specific danger it loops, and much of coping is learning to tell the two apart."},
    {"id":"shame","title":"Shame","voice":"layered","orb":"connecting","parents":["emotion"],"wiki":"Shame","summary":"The feeling of being seen falling short. It's deeply social: the same act can bring shame in one place and none in another. Useful in small doses, corrosive when it becomes an identity."},
    {"id":"guilt","title":"Guilt","voice":"layered","orb":"solving","parents":["shame"],"wiki":"Guilt (emotion)","summary":"Shame's more useful cousin: not I am bad but I did something wrong. It points toward repair, and it fades when the repair is made or the lesson is learned."},
    {"id":"hope","title":"Hope","voice":"layered","orb":"shaping","parents":["emotion"],"wiki":"Hope","summary":"A stubborn bet on the shape of tomorrow. It doesn't need evidence to begin, only enough openness to move toward something not yet true."}
  ],
  "links": [
    ["emotion", "humanity"], ["emotion", "music"], ["emotion", "memory"], ["emotion", "care"], ["emotion", "story"],
    ["emotion", "body"], ["emotion", "evolution"], ["emotion", "feedback"], ["emotion", "poetry"], ["emotion", "resonance"],
    ["love", "care"], ["love", "hope"], ["love", "cooperation"], ["love", "death"], ["love", "grief"],
    ["love", "music"], ["love", "story"], ["love", "art"], ["love", "poetry"], ["love", "religion"],
    ["love", "memory"], ["love", "time"], ["love", "identity"], ["love", "trust"], ["love", "evolution"],
    ["love", "kindness"], ["love", "compassion"], ["love", "empathy"], ["love", "gratitude"], ["love", "symbiosis"],
    ["love", "joy"], ["love", "regret"], ["love", "fear"], ["love", "myth"], ["attachment", "family"],
    ["attachment", "trust"], ["attachment", "identity"], ["attachment", "learning"], ["attachment", "fear"], ["oxytocin", "trust"],
    ["oxytocin", "body"], ["oxytocin", "cooperation"], ["friendship", "trust"], ["friendship", "cooperation"], ["friendship", "loneliness"],
    ["friendship", "laughter"], ["friendship", "care"], ["friendship", "conflict"], ["friendship", "identity"], ["friendship", "language"],
    ["friendship", "time"], ["family", "identity"], ["family", "dna"], ["family", "conflict"], ["family", "language"],
    ["family", "history"], ["family", "death"], ["family", "care"], ["forgiveness", "regret"], ["forgiveness", "anger"],
    ["forgiveness", "guilt"], ["forgiveness", "religion"], ["forgiveness", "peace"], ["forgiveness", "compassion"], ["forgiveness", "justice"],
    ["forgiveness", "boundaries"], ["agape", "religion"], ["agape", "compassion"], ["agape", "buddhism"], ["agape", "care"],
    ["agape", "good"], ["loneliness", "social-media"], ["loneliness", "technology-behavior"], ["loneliness", "identity"], ["grief", "death"],
    ["grief", "ritual"], ["grief", "memory"], ["grief", "peace"], ["grief", "story"], ["grief", "music"],
    ["grief", "religion"], ["grief", "time"], ["grief", "regret"], ["joy", "play"], ["joy", "music"],
    ["joy", "wonder"], ["laughter", "play"], ["laughter", "sound"], ["laughter", "evolution"], ["gratitude", "care"],
    ["gratitude", "meditation"], ["gratitude", "kindness"], ["anger", "conflict"], ["anger", "justice"], ["anger", "fear"],
    ["anger", "boundaries"], ["anger", "body"], ["anger", "regret"], ["empathy", "care"], ["empathy", "compassion"],
    ["empathy", "language"], ["empathy", "neurons"], ["empathy", "cooperation"], ["fear", "conflict"], ["fear", "trust"],
    ["fear", "evolution"], ["fear", "body"], ["fear", "security"], ["fear", "story"], ["courage", "hope"],
    ["courage", "care"], ["anxiety", "body"], ["anxiety", "sleep"], ["anxiety", "attention"], ["anxiety", "meditation"],
    ["anxiety", "probability"], ["shame", "identity"], ["shame", "regret"], ["shame", "privacy"], ["shame", "body"],
    ["shame", "family"], ["guilt", "regret"], ["guilt", "law"], ["guilt", "justice"], ["guilt", "consequence"],
    ["hope", "time"], ["hope", "peace"], ["hope", "imagination"], ["hope", "religion"], ["hope", "probability"],
    ["hope", "science"]
  ]
}
