{
  "$schema": "../concept.schema.json",
  "cluster": "mathematics",
  "description": "Numbers, shape, proof, chance, and the structures that turn out to describe everything else.",
  "concepts": [
    {"id":"mathematics","title":"Mathematics","voice":"lucid","orb":"shaping","parents":["entropy"],"wiki":"Mathematics","summary":"The one place where “obviously” can be proven. Simple rules, followed all the way to their consequences, keep turning out to describe things they were never designed for."},
    {"id":"numbers","title":"Numbers","voice":"lucid","orb":"listening","parents":["mathematics"],"wiki":"Number","summary":"Counting begins as a habit and turns into a language. Whole numbers, fractions, negatives, the square root of two: each new kind of number was made to answer a question the old ones couldn't."},
    {"id":"zero","title":"Zero","voice":"lucid","orb":"searching","parents":["numbers"],"wiki":"0","summary":"Not just an empty place but a number you can add, multiply, and divide by, with one exception. Treating nothing as something is what made positional notation, algebra, and eventually computers possible."},
    {"id":"prime-numbers","title":"Primes","voice":"lucid","orb":"working","parents":["numbers"],"wiki":"Prime number","summary":"Numbers with no divisors but one and themselves. Every whole number is built from them uniquely, yet their pattern is elusive, and the difficulty of factoring large ones underpins much of modern encryption."},
    {"id":"pi","title":"Pi","voice":"lucid","orb":"composing","parents":["numbers"],"wiki":"Pi","summary":"The ratio of a circle's circumference to its diameter, about 3.14159, and irrational: its digits never end or repeat. It turns up far from circles, in waves, probability, and the structure of the universe."},
    {"id":"golden-ratio","title":"Golden Ratio","voice":"lucid","orb":"shaping","parents":["numbers","geometry"],"wiki":"Golden ratio","summary":"About 1.618: the proportion where the whole is to the larger part as the larger part is to the smaller. It appears in some plants and pentagons, and is credited with far more mystique than the evidence supports."},
    {"id":"imaginary-numbers","title":"Imaginary Numbers","voice":"lucid","orb":"weaving","parents":["numbers"],"wiki":"Imaginary number","summary":"Invent a number whose square is minus one and a whole new algebra opens. The name is unlucky: complex numbers are essential to describing waves, circuits, and quantum states."},
    {"id":"infinity","title":"Infinity","voice":"lucid","orb":"breathing","parents":["mathematics"],"wiki":"Infinity","summary":"Not a very large number but a different kind of thing. Some infinities are provably bigger than others, which is one of the strangest results we have, and it follows from a few lines of logic."},
    {"id":"set-theory","title":"Set Theory","voice":"lucid","orb":"connecting","parents":["infinity"],"wiki":"Set theory","summary":"Mathematics rebuilt from one idea: collections of things. From sets alone you can define numbers, functions, and infinities of different sizes, and it became the foundation nearly everything else is stated in."},
    {"id":"paradox","title":"Paradox","voice":"lucid","orb":"searching","parents":["infinity","logic"],"wiki":"Paradox","summary":"A chain of reasoning that seems sound and ends somewhere absurd. Paradoxes are useful: each one marks a hidden assumption, and resolving them has repeatedly forced mathematics to grow."},
    {"id":"proof","title":"Proof","voice":"lucid","orb":"solving","parents":["mathematics"],"wiki":"Mathematical proof","summary":"Establishing something so that no further doubt is reasonable. A proof isn't persuasion; it's a chain in which every step is forced by the one before, and anyone can check the links."},
    {"id":"godel","title":"Incompleteness","voice":"lucid","orb":"weaving","parents":["logic","set-theory"],"wiki":"Gödel's incompleteness theorems","summary":"Any consistent system rich enough for arithmetic contains true statements it can't prove. It ended the hope of a single complete foundation for mathematics, and did it using mathematics."},
    {"id":"probability","title":"Probability","voice":"lucid","orb":"working","parents":["mathematics"],"wiki":"Probability","summary":"A way to be precise about not knowing. It turns uncertainty into numbers you can combine, update, and act on, and it's the same math that describes gases, genes, and guesses."},
    {"id":"randomness","title":"Randomness","voice":"lucid","orb":"searching","parents":["probability"],"wiki":"Randomness","summary":"Outcomes with no pattern you could use to predict them. True randomness is surprisingly hard to define, and hard to produce; most of what computers call random is a very good imitation."},
    {"id":"statistics","title":"Statistics","voice":"lucid","orb":"connecting","parents":["probability"],"wiki":"Statistics","summary":"Learning from data despite noise. It tells you how much a sample can be trusted and how easily a pattern can be an accident, which makes it as much about doubt as about knowing."},
    {"id":"chaos","title":"Chaos","voice":"lucid","orb":"weaving","parents":["probability"],"wiki":"Chaos theory","summary":"Simple, exact rules can still be unpredictable in practice. A tiny difference at the start grows until it swamps everything, which is why weather can't be forecast far ahead even with perfect equations."},
    {"id":"fractals","title":"Fractals","voice":"lucid","orb":"shaping","parents":["chaos"],"wiki":"Fractal","summary":"Shapes that look similar at every scale: coastlines, ferns, lightning, the edges of clouds. A very short rule, repeated, can produce endless detail."},
    {"id":"symmetry","title":"Symmetry","voice":"lucid","orb":"shaping","parents":["mathematics"],"wiki":"Symmetry","summary":"A change that leaves something unchanged. Rotate a snowflake by sixty degrees and it looks the same; swap two identical particles and the physics doesn't notice. Whole laws of nature are statements about what stays fixed."},
    {"id":"group-theory","title":"Group Theory","voice":"lucid","orb":"solving","parents":["symmetry"],"wiki":"Group theory","summary":"The algebra of symmetry: what happens when you combine transformations. It classifies crystals and particles, and it explains why a Rubik's cube has exactly the moves it does."},
    {"id":"logic","title":"Logic","voice":"lucid","orb":"weaving","parents":["mathematics"],"wiki":"Logic","summary":"The rules for moving from what you accept to what must follow. Reduce reasoning to switches and it can be built from transistors, which is why a very old idea now runs in your pocket."},
    {"id":"algorithms","title":"Algorithms","voice":"lucid","orb":"solving","parents":["logic"],"wiki":"Algorithm","summary":"A precise recipe: do this, then this, until a condition says stop. An algorithm doesn't need to understand what it's doing, which is exactly why a machine can carry it out."},
    {"id":"geometry","title":"Geometry","voice":"lucid","orb":"searching","parents":["mathematics"],"wiki":"Geometry","summary":"The mathematics of shape and space, from the surveyor's field to curved spacetime. Euclid built it from five simple assumptions; changing one of them opened whole new worlds."},
    {"id":"topology","title":"Topology","voice":"lucid","orb":"searching","parents":["geometry"],"wiki":"Topology","summary":"Geometry that ignores size and shape and keeps only what survives stretching: holes, connections, edges. To a topologist a coffee cup and a doughnut are the same object."},
    {"id":"calculus","title":"Calculus","voice":"lucid","orb":"composing","parents":["mathematics"],"wiki":"Calculus","summary":"The mathematics of change and accumulation. It turns motion into slopes and slopes back into distance, and it gave physics its language for everything that moves, flows, or grows."}
  ],
  "links": [
    ["mathematics", "music"], ["mathematics", "silicon"], ["mathematics", "truth"], ["numbers", "music"], ["numbers", "money"],
    ["numbers", "ram"], ["numbers", "binary"], ["zero", "binary"], ["zero", "infinity"], ["zero", "emptiness"],
    ["prime-numbers", "cryptography"], ["prime-numbers", "public-key"], ["prime-numbers", "patterns"], ["pi", "waves"], ["pi", "geometry"],
    ["pi", "fractals"], ["golden-ratio", "patterns"], ["golden-ratio", "perspective"], ["imaginary-numbers", "quantum-mechanics"], ["imaginary-numbers", "electricity"],
    ["infinity", "time"], ["infinity", "proof"], ["infinity", "religion"], ["set-theory", "logic"], ["set-theory", "data"],
    ["paradox", "consciousness"], ["paradox", "truth"], ["proof", "trust"], ["proof", "algorithms"], ["proof", "logic"],
    ["proof", "science"], ["proof", "cryptography"], ["godel", "consciousness"], ["godel", "knowledge"], ["godel", "truth"],
    ["probability", "entropy"], ["randomness", "cryptography"], ["randomness", "evolution"], ["randomness", "entropy"], ["randomness", "hashing"],
    ["statistics", "trust"], ["chaos", "cycles"], ["chaos", "ecosystems"], ["chaos", "patterns"], ["chaos", "water"],
    ["chaos", "weather"], ["fractals", "patterns"], ["fractals", "nature"], ["symmetry", "patterns"], ["symmetry", "music"],
    ["symmetry", "crystal-ingot"], ["symmetry", "order"], ["group-theory", "cryptography"], ["group-theory", "mechanisms"], ["logic", "transistors"],
    ["logic", "mechanisms"], ["logic", "truth"], ["algorithms", "machine-learning"], ["algorithms", "ram"], ["algorithms", "cryptography"],
    ["algorithms", "hashing"], ["topology", "networks"], ["topology", "relation"], ["calculus", "engines"], ["calculus", "cycles"],
    ["calculus", "orbits"]
  ]
}
